{
  "$schema": "https://json-schema.org/draft/2020-12/schema",
  "$id": "https://mmm-platform.local/contracts/validation_result_v2.schema.json",
  "title": "ValidationResultV2",
  "type": "object",
  "additionalProperties": false,
  "required": ["contract_name", "schema_version", "validation_id", "status", "job_creation_allowed", "file_validation", "federal_allocation", "model_limitations", "map_coverage", "geo_points"],
  "properties": {
    "contract_name": {"const": "validation_result_v2"},
    "schema_version": {"const": "2.0.0"},
    "validation_id": {"type": "string"},
    "status": {"enum": ["passed", "warning", "failed", "unavailable"]},
    "job_creation_allowed": {"type": "boolean"},
    "file_validation": {
      "type": "object",
      "additionalProperties": false,
      "required": ["status", "rows_n", "campaigns_n", "geographies_n", "channels_n", "requested_budget_rub", "blocking_errors_n", "warnings_n", "checks"],
      "properties": {
        "status": {"enum": ["passed", "warning", "failed", "unavailable"]},
        "rows_n": {"type": "integer", "minimum": 0},
        "campaigns_n": {"type": "integer", "minimum": 0},
        "geographies_n": {"type": "integer", "minimum": 0},
        "channels_n": {"type": "integer", "minimum": 0},
        "requested_budget_rub": {"type": "number", "minimum": 0},
        "blocking_errors_n": {"type": "integer", "minimum": 0},
        "warnings_n": {"type": "integer", "minimum": 0},
        "checks": {"type": "array", "items": {"type": "object", "required": ["code", "status", "display_text"], "properties": {"code": {"type": "string"}, "status": {"enum": ["passed", "warning", "failed", "unavailable"]}, "display_text": {"type": "string"}}, "additionalProperties": false}}
      }
    },
    "federal_allocation": {
      "type": "object",
      "additionalProperties": false,
      "required": ["status", "title", "description", "policy_version", "package_id", "source_rows_count", "source_budget_rub", "allocated_budget_rub", "difference_rub", "geo_count", "declared_geo_count", "ready_geo_count", "excluded_geo_count", "denominator_policy_version", "lmax", "required_period_start", "required_period_end", "method_display_name", "channels", "business_directions", "mixed_local_overlap", "information", "warnings", "errors", "breakdown"],
      "properties": {
        "status": {"enum": ["none", "available", "error"]},
        "title": {"type": ["string", "null"]},
        "description": {"type": ["string", "null"]},
        "policy_version": {"type": ["string", "null"]},
        "package_id": {"type": ["string", "null"]},
        "source_rows_count": {"type": "integer", "minimum": 0},
        "source_budget_rub": {"type": "number", "minimum": 0},
        "allocated_budget_rub": {"type": "number", "minimum": 0},
        "difference_rub": {"type": "number", "minimum": 0},
        "geo_count": {"type": ["integer", "null"], "minimum": 1},
        "declared_geo_count": {"type": ["integer", "null"], "minimum": 0},
        "ready_geo_count": {"type": ["integer", "null"], "minimum": 0},
        "excluded_geo_count": {"type": ["integer", "null"], "minimum": 0},
        "denominator_policy_version": {"type": ["string", "null"]},
        "lmax": {"type": ["integer", "null"], "minimum": 0},
        "required_period_start": {"type": ["string", "null"], "format": "date"},
        "required_period_end": {"type": ["string", "null"], "format": "date"},
        "method_display_name": {"type": ["string", "null"]},
        "channels": {"type": "array", "items": {"$ref": "#/$defs/channelIdentity"}, "uniqueItems": true},
        "business_directions": {"type": "array", "items": {"type": "string", "minLength": 1}, "uniqueItems": true},
        "mixed_local_overlap": {"type": "boolean"},
        "information": {"type": "array", "items": {"$ref": "#/$defs/statusMessage"}, "uniqueItems": true},
        "warnings": {"type": "array", "items": {"$ref": "#/$defs/statusMessage"}, "uniqueItems": true},
        "errors": {"type": "array", "items": {"$ref": "#/$defs/statusMessage"}, "uniqueItems": true},
        "breakdown": {
          "type": "array",
          "items": {
            "type": "object",
            "additionalProperties": false,
            "required": ["business_direction", "channels", "source_rows_count", "source_budget_rub", "allocated_budget_rub", "difference_rub", "geo_count", "declared_geo_count", "ready_geo_count", "excluded_geo_count", "period_start", "period_end"],
            "properties": {
              "business_direction": {"type": "string", "minLength": 1},
              "channels": {"type": "array", "items": {"$ref": "#/$defs/channelIdentity"}, "uniqueItems": true},
              "source_rows_count": {"type": "integer", "minimum": 0},
              "source_budget_rub": {"type": "number", "minimum": 0},
              "allocated_budget_rub": {"type": "number", "minimum": 0},
              "difference_rub": {"type": "number", "minimum": 0},
              "geo_count": {"type": ["integer", "null"], "minimum": 1},
              "declared_geo_count": {"type": ["integer", "null"], "minimum": 0},
              "ready_geo_count": {"type": ["integer", "null"], "minimum": 0},
              "excluded_geo_count": {"type": ["integer", "null"], "minimum": 0},
              "period_start": {"type": ["string", "null"], "format": "date"},
              "period_end": {"type": ["string", "null"], "format": "date"}
            }
          }
        }
      }
    },
    "model_limitations": {
      "type": "array",
      "items": {
        "type": "object",
        "additionalProperties": false,
        "required": ["target", "channel_id", "channel_display_name", "limitation_type", "affected_geos_n", "affected_geos", "severity", "allowed_use", "blocks_calculation", "what", "why", "recommended_action"],
        "properties": {
          "target": {"const": "turnover"},
          "channel_id": {"type": "string"},
          "channel_display_name": {"type": "string"},
          "limitation_type": {"type": "string"},
          "affected_geos_n": {"type": "integer", "minimum": 0},
          "affected_geos": {"type": "array", "items": {"type": "string"}, "uniqueItems": true},
          "severity": {"enum": ["information", "warning", "manual_review", "blocking"]},
          "allowed_use": {"enum": ["primary", "caution", "diagnostic", "unsupported", "unavailable"]},
          "blocks_calculation": {"type": "boolean"},
          "what": {"type": "string"},
          "why": {"type": "string"},
          "recommended_action": {"type": "string"}
        }
      }
    },
    "map_coverage": {"$ref": "#/$defs/budgetCoverage"},
    "geo_points": {
      "type": "array",
      "items": {"$ref": "#/$defs/geoPoint"}
    }
  },
  "$defs": {
    "statusMessage": {
      "type": "object",
      "additionalProperties": false,
      "required": ["code", "display_text"],
      "properties": {
        "code": {"type": "string", "minLength": 1},
        "display_text": {"type": "string", "minLength": 1}
      }
    },
    "channelIdentity": {
      "type": "object",
      "additionalProperties": false,
      "required": ["channel_id", "channel_display_name"],
      "properties": {
        "channel_id": {"type": "string", "minLength": 1},
        "channel_display_name": {"type": "string", "minLength": 1}
      }
    },
    "geoPoint": {
      "oneOf": [
        {"$ref": "#/$defs/canonicalGeoPoint"},
        {"$ref": "#/$defs/unavailableGeoPoint"}
      ]
    },
    "canonicalGeoPoint": {
      "type": "object",
      "additionalProperties": false,
      "required": ["geo_id", "geo_display_name", "input_geo_name", "canonical_geo_id", "canonical_geo_display_name", "normalization_status", "normalization_rule", "latitude", "longitude", "coordinates_status", "region_id", "region_display_name", "budget_rub", "budget_share", "channels", "has_model_limitations", "model_limitations_n"],
      "properties": {
        "geo_id": {"type": "string", "pattern": "^geo_[0-9a-f]{16}$"},
        "geo_display_name": {"type": "string", "minLength": 1},
        "input_geo_name": {"type": "string", "minLength": 1},
        "canonical_geo_id": {"type": "string", "pattern": "^geo_[0-9a-f]{16}$"},
        "canonical_geo_display_name": {"type": "string", "minLength": 1},
        "normalization_status": {"enum": ["canonical", "alias"]},
        "normalization_rule": {"type": "string", "minLength": 1},
        "latitude": {"type": "number", "minimum": -90, "maximum": 90},
        "longitude": {"type": "number", "minimum": -180, "maximum": 180},
        "coordinates_status": {"const": "canonical"},
        "region_id": {"type": "string", "minLength": 1},
        "region_display_name": {"type": "string", "minLength": 1},
        "budget_rub": {"type": "number", "minimum": 0},
        "budget_share": {"type": ["number", "null"], "minimum": 0, "maximum": 1},
        "channels": {"type": "array", "items": {"type": "object", "required": ["channel_id", "channel_display_name"], "properties": {"channel_id": {"type": "string"}, "channel_display_name": {"type": "string"}}, "additionalProperties": false}},
        "has_model_limitations": {"type": "boolean"},
        "model_limitations_n": {"type": "integer", "minimum": 0}
      }
    },
    "unavailableGeoPoint": {
      "type": "object",
      "additionalProperties": false,
      "required": ["geo_id", "geo_display_name", "input_geo_name", "canonical_geo_id", "canonical_geo_display_name", "normalization_status", "normalization_rule", "latitude", "longitude", "coordinates_status", "region_id", "region_display_name", "budget_rub", "budget_share", "channels", "has_model_limitations", "model_limitations_n"],
      "properties": {
        "geo_id": {"type": "string", "pattern": "^geo_[0-9a-f]{16}$"},
        "geo_display_name": {"type": "string", "minLength": 1},
        "input_geo_name": {"type": "string", "minLength": 1},
        "canonical_geo_id": {"type": "null"},
        "canonical_geo_display_name": {"type": "null"},
        "normalization_status": {"enum": ["unknown", "ambiguous"]},
        "normalization_rule": {"type": "string", "minLength": 1},
        "latitude": {"type": "null"},
        "longitude": {"type": "null"},
        "coordinates_status": {"const": "unavailable"},
        "region_id": {"type": "null"},
        "region_display_name": {"type": "null"},
        "budget_rub": {"type": "number", "minimum": 0},
        "budget_share": {"type": ["number", "null"], "minimum": 0, "maximum": 1},
        "channels": {"type": "array", "items": {"type": "object", "required": ["channel_id", "channel_display_name"], "properties": {"channel_id": {"type": "string"}, "channel_display_name": {"type": "string"}}, "additionalProperties": false}},
        "has_model_limitations": {"type": "boolean"},
        "model_limitations_n": {"type": "integer", "minimum": 0}
      }
    },
    "geoIdentity": {
      "type": "object",
      "additionalProperties": false,
      "required": ["geo_id", "geo_display_name"],
      "properties": {
        "geo_id": {"type": "string", "pattern": "^geo_[0-9a-f]{16}$"},
        "geo_display_name": {"type": "string", "minLength": 1}
      }
    },
    "budgetCoverage": {
      "type": "object",
      "additionalProperties": false,
      "required": ["status", "located_geographies_n", "unlocated_geographies_n", "unlocated_geographies", "located_budget_rub", "unlocated_budget_rub", "unlocated_budget_share"],
      "properties": {
        "status": {"enum": ["available", "partial", "unavailable"]},
        "located_geographies_n": {"type": "integer", "minimum": 0},
        "unlocated_geographies_n": {"type": "integer", "minimum": 0},
        "unlocated_geographies": {"type": "array", "items": {"$ref": "#/$defs/geoIdentity"}, "uniqueItems": true},
        "located_budget_rub": {"type": "number", "minimum": 0},
        "unlocated_budget_rub": {"type": "number", "minimum": 0},
        "unlocated_budget_share": {"type": ["number", "null"], "minimum": 0, "maximum": 1}
      }
    }
  }
}
