{
  "contract_name": "validation_result_v2",
  "schema_version": "2.0.0",
  "validation_id": "validation_38fc0ce73e4be020fc18",
  "status": "warning",
  "job_creation_allowed": true,
  "file_validation": {
    "status": "passed",
    "rows_n": 2,
    "campaigns_n": 1,
    "geographies_n": 175,
    "channels_n": 1,
    "requested_budget_rub": 101000000,
    "blocking_errors_n": 0,
    "warnings_n": 0,
    "checks": [
      {
        "code": "FILE_STRUCTURE",
        "status": "passed",
        "display_text": "Структура файла и обязательные поля распознаны."
      },
      {
        "code": "CAMPAIGN_COUNT",
        "status": "passed",
        "display_text": "В файле найдена ровно одна кампания."
      },
      {
        "code": "BUDGET_RECONCILIATION",
        "status": "passed",
        "display_text": "Сумма бюджета в исходном плане совпадает с суммой после распределения по дням."
      },
      {
        "code": "DATES",
        "status": "passed",
        "display_text": "Даты кампании распознаны и имеют корректный порядок."
      }
    ]
  },
  "federal_allocation": {
    "status": "available",
    "title": "Обнаружено федеральное размещение",
    "description": "Федеральный бюджет распределен между географиями, для которых модель поддерживает расчет на выбранный период, пропорционально численности населения.",
    "policy_version": "FEDERAL_GEO_ALLOCATION_V1",
    "package_id": "pkg_807d3ddbae57a52a_9aacd3beb350725b",
    "source_rows_count": 1,
    "source_budget_rub": 100000000,
    "allocated_budget_rub": 100000000,
    "difference_rub": 0,
    "geo_count": 175,
    "declared_geo_count": 211,
    "ready_geo_count": 175,
    "excluded_geo_count": 36,
    "denominator_policy_version": "FORECAST_DENOMINATOR_RESOLUTION_V1",
    "lmax": 14,
    "required_period_start": "2026-09-01",
    "required_period_end": "2026-09-15",
    "method_display_name": "Пропорционально населению",
    "channels": [
      {
        "channel_id": "Digital_Performance",
        "channel_display_name": "Цифровая реклама"
      }
    ],
    "business_directions": [
      "ТС5/Онлайн"
    ],
    "mixed_local_overlap": true,
    "information": [
      {
        "code": "FEDERAL_GEO_ALLOCATION_INFO",
        "display_text": "Федеральный бюджет будет распределен между географиями, для которых модель поддерживает расчет на выбранный период, по действующей методике модели."
      }
    ],
    "warnings": [
      {
        "code": "FEDERAL_AND_LOCAL_GEO_OVERLAP",
        "display_text": "В плане одновременно указаны федеральный бюджет и отдельные локальные бюджеты. Локальные суммы будут добавлены поверх федерального распределения."
      }
    ],
    "errors": [],
    "breakdown": [
      {
        "business_direction": "ТС5/Онлайн",
        "channels": [
          {
            "channel_id": "Digital_Performance",
            "channel_display_name": "Цифровая реклама"
          }
        ],
        "source_rows_count": 1,
        "source_budget_rub": 100000000,
        "allocated_budget_rub": 100000000,
        "difference_rub": 0,
        "geo_count": 175,
        "declared_geo_count": 211,
        "ready_geo_count": 175,
        "excluded_geo_count": 36,
        "period_start": "2026-09-01",
        "period_end": "2026-09-15"
      }
    ]
  },
  "model_limitations": [
    {
      "target": "turnover",
      "channel_id": "Digital_Performance",
      "channel_display_name": "Цифровая реклама",
      "limitation_type": "model_caution_cells",
      "severity": "warning",
      "allowed_use": "caution",
      "blocks_calculation": false,
      "what": "Строк с ограничениями по использованию оценки: 175.",
      "why": "Для указанных сочетаний оценка разрешена только с ограничениями качества.",
      "recommended_action": "Проверьте отмеченные строки и не используйте их как единственное основание для перераспределения бюджета.",
      "affected_geos_n": 175,
      "affected_geos": [
        "Александров",
        "Алтайский край",
        "Апатиты",
        "Армавир",
        "Архангельск",
        "Архангельская область",
        "Астраханская область",
        "Астрахань",
        "Балашиха",
        "Барнаул",
        "Батайск",
        "Белгород",
        "Белгородская область",
        "Березовский",
        "Боровичи",
        "Брянск",
        "Великие Луки",
        "Великий Новгород",
        "Видное",
        "Владивосток",
        "Владимир",
        "Волгоград",
        "Волгоградская область",
        "Вологда",
        "Вологодская область",
        "Воронеж",
        "Воронежская область",
        "Выборг",
        "Вышний Волочек",
        "Вязники",
        "Гусь-Хрустальный",
        "Долгопрудный",
        "Домодедово",
        "Екатеринбург",
        "Забайкальский край",
        "Иваново",
        "Ивановская область",
        "Ижевск",
        "Иркутск",
        "Иркутская область",
        "Йошкар-Ола",
        "Кабардино-Балкарская Республика",
        "Казань",
        "Калининград",
        "Калининградская область",
        "Калуга",
        "Кемерово",
        "Кемеровская область",
        "Кинешма",
        "Кириши",
        "Киров",
        "Кировск",
        "Кировская область",
        "Кисловодск",
        "Ковров",
        "Конаково",
        "Королев",
        "Коряжма",
        "Кострома",
        "Костромская область",
        "Котлас",
        "Красногорск",
        "Краснодар",
        "Краснодарский край",
        "Красноярск",
        "Красноярский край",
        "Кузнецк",
        "Курган",
        "Курганская область",
        "Курск",
        "Курская область",
        "Ленинградская область",
        "Липецк",
        "Липецкая область",
        "Лобня",
        "Магнитогорск",
        "Майкоп",
        "Мичуринск",
        "Мончегорск",
        "Москва",
        "Московская область",
        "Мурманск",
        "Мурманская область",
        "Мытищи",
        "Набережные Челны",
        "Нижегородская область",
        "Нижневартовск",
        "Нижний Тагил",
        "Новгородская область",
        "Новороссийск",
        "Новосибирск",
        "Новосибирская область",
        "Оленегорск",
        "Омск",
        "Омская область",
        "Орел",
        "Оренбург",
        "Оренбургская область",
        "Орловская область",
        "Остров",
        "Пенза",
        "Пензенская область",
        "Переславль-Залесский",
        "Пермский край",
        "Пермь",
        "Петрозаводск",
        "Подольск",
        "Псков",
        "Псковская область",
        "Республика Адыгея",
        "Республика Башкортостан",
        "Республика Бурятия",
        "Республика Калмыкия",
        "Республика Карелия",
        "Республика Коми",
        "Республика Марий Эл",
        "Республика Мордовия",
        "Республика Северная Осетия - Алания",
        "Республика Татарстан",
        "Ростов-на-Дону",
        "Ростовская область",
        "Рыбинск",
        "Рязань",
        "Самара",
        "Самарская область",
        "Санкт-Петербург",
        "Саранск",
        "Саратов",
        "Саратовская область",
        "Свердловская область",
        "Северодвинск",
        "Смоленск",
        "Сокол",
        "Солнечногорск",
        "Сочи",
        "Ставрополь",
        "Ставропольский край",
        "Старый Оскол",
        "Сургут",
        "Сыктывкар",
        "Тамбов",
        "Тамбовская область",
        "Тверская область",
        "Тверь",
        "Тольятти",
        "Томск",
        "Томская область",
        "Торжок",
        "Тула",
        "Тутаев",
        "Тюменская область",
        "Тюмень",
        "Углич",
        "Удмуртская Республика",
        "Удомля",
        "Улан-Удэ",
        "Ульяновск",
        "Ульяновская область",
        "Уфа",
        "Ухта",
        "Хабаровск",
        "Хабаровский край",
        "Ханты-Мансийский автономный округ - Югра",
        "Химки",
        "Чебоксары",
        "Челябинск",
        "Челябинская область",
        "Череповец",
        "Чита",
        "Чувашская Республика",
        "Шуя",
        "Щелково",
        "Энгельс",
        "Ярославль",
        "Ярославская область"
      ]
    }
  ],
  "map_coverage": {
    "status": "available",
    "located_geographies_n": 175,
    "unlocated_geographies_n": 0,
    "unlocated_geographies": [],
    "located_budget_rub": 101000000,
    "unlocated_budget_rub": 0,
    "unlocated_budget_share": 0
  },
  "geo_points": [
    {
      "geo_id": "geo_957e66011fc7614c",
      "geo_display_name": "Александров",
      "latitude": 56.39733,
      "longitude": 38.71404,
      "coordinates_status": "canonical",
      "region_id": "region_geonames_826294",
      "region_display_name": "Владимирская область",
      "input_geo_name": "АЛЕКСАНДРОВ",
      "canonical_geo_id": "geo_957e66011fc7614c",
      "canonical_geo_display_name": "Александров",
      "normalization_status": "canonical",
      "normalization_rule": "canonical_name",
      "budget_rub": 33085.78079488588,
      "budget_share": 0.00032758198806817705,
      "channels": [
        {
          "channel_id": "Digital_Performance",
          "channel_display_name": "Цифровая реклама"
        }
      ],
      "has_model_limitations": true,
      "model_limitations_n": 1
    },
    {
      "geo_id": "geo_ef9368375b7cd433",
      "geo_display_name": "Алтайский край",
      "latitude": 52.60833,
      "longitude": 82.60833,
      "coordinates_status": "canonical",
      "region_id": "region_geonames_1511732",
      "region_display_name": "Алтайский край",
      "input_geo_name": "АЛТАЙСКИЙ КРАЙ",
      "canonical_geo_id": "geo_ef9368375b7cd433",
      "canonical_geo_display_name": "Алтайский край",
      "normalization_status": "canonical",
      "normalization_rule": "canonical_name",
      "budget_rub": 1339974.1221928783,
      "budget_share": 0.013267070516761171,
      "channels": [
        {
          "channel_id": "Digital_Performance",
          "channel_display_name": "Цифровая реклама"
        }
      ],
      "has_model_limitations": true,